{
  "config": {
    "input_seed": 42,
    "timed_runs": 10,
    "tolerance_abs": 0.00001,
    "tolerance_rel": 0.001,
    "warmup_runs": 3
  },
  "input_spec": "1x256x64x64:float32;1x2x256:float32;1x64x128x128:float32;1x32x256x256:float32",
  "license": "apache-2.0",
  "model_id": "sam2.1-hiera-tiny-mask-decoder__sam2_tiny_mask_decoder_v2_fp16",
  "notes": "",
  "results": [
    {
      "backend": "wasm_xnnpack",
      "date": "2026-10-05",
      "delegation_evidence": [
        "error: WARNING: [npu_registry.cc:34] NPU accelerator could not be loaded and registered: kLiteRtStatusErrorInvalidArgument.",
        "error: WARNING: [npu_registry.cc:34] NPU accelerator could not be loaded and registered: kLiteRtStatusErrorInvalidArgument."
      ],
      "env": {
        "browser": "chromium",
        "browser_version": "151.0.7922.34",
        "headless": true,
        "jspi": true,
        "litertjs_core_version": "2.5.3",
        "machine_label": "ci-ubuntu-x64",
        "os": "Linux",
        "os_version": "6.17.0-1022-azure",
        "webgpu_adapter": {
          "architecture": "swiftshader",
          "description": "",
          "device": "",
          "vendor": "google"
        }
      },
      "error": null,
      "failure_class": null,
      "full_delegation": null,
      "latency_p50_ms": 794.287,
      "loads": true,
      "max_abs_diff": null,
      "max_rel_diff": null,
      "output_match": null,
      "provenance": "measured",
      "runs": true
    },
    {
      "backend": "webgpu_mldrift",
      "date": "2026-10-05",
      "delegation_evidence": [
        "error: WARNING: [npu_registry.cc:34] NPU accelerator could not be loaded and registered: kLiteRtStatusErrorInvalidArgument.",
        "error: WARNING: [npu_registry.cc:34] NPU accelerator could not be loaded and registered: kLiteRtStatusErrorInvalidArgument.",
        "warning: Texture size ([Extent3D width:16384, height:8, depthOrArrayLayers:1]) exceeded maximum texture size ([Extent3D width:8192, height:8192, depthOrArrayLayers:256]).\n - While validating [TextureDescriptor].\n - While calling [Device].CreateTexture([TextureDescriptor]).\n",
        "warning: [Invalid Texture] is invalid due to a previous error.\n - While calling [Invalid Texture].CreateView([TextureViewDescriptor]).\n",
        "warning: Texture size ([Extent3D width:16384, height:8, depthOrArrayLayers:1]) exceeded maximum texture size ([Extent3D width:8192, height:8192, depthOrArrayLayers:256]).\n - While validating [TextureDescriptor].\n - While calling [Device].CreateTexture([TextureDescriptor]).\n",
        "warning: [Invalid Texture] is invalid due to a previous error.\n - While calling [Invalid Texture].CreateView([TextureViewDescriptor]).\n",
        "warning: Texture size ([Extent3D width:16384, height:8, depthOrArrayLayers:1]) exceeded maximum texture size ([Extent3D width:8192, height:8192, depthOrArrayLayers:256]).\n - While validating [TextureDescriptor].\n - While calling [Device].CreateTexture([TextureDescriptor]).\n",
        "warning: [Invalid Texture] is invalid due to a previous error.\n - While calling [Invalid Texture].CreateView([TextureViewDescriptor]).\n",
        "warning: Texture size ([Extent3D width:16384, height:8, depthOrArrayLayers:1]) exceeded maximum texture size ([Extent3D width:8192, height:8192, depthOrArrayLayers:256]).\n - While validating [TextureDescriptor].\n - While calling [Device].CreateTexture([TextureDescriptor]).\n",
        "warning: [Invalid Texture] is invalid due to a previous error.\n - While calling [Invalid Texture].CreateView([TextureViewDescriptor]).\n",
        "warning: [Invalid TextureView] is invalid due to a previous error.\n - While validating entries[1] against { binding: 0, visibility: ShaderStage::Compute, storageTexture: {format: TextureFormat::RGBA32Float, viewDimension: TextureViewDimension::e2D, access: StorageTextureAccess::WriteOnly} }.\n - While validating [BindGroupDescriptor] against [BindGroupLayout (unlabeled)]\n - While calling [Device].CreateBindGroup([BindGroupDescriptor]).\n",
        "warning: [Invalid TextureView] is invalid due to a previous error.\n - While validating entries[2] against { binding: 1, visibility: ShaderStage::Compute, texture: {sampleType: TextureSampleType::UnfilterableFloat, viewDimension: TextureViewDimension::e2D, multisampled: 0} }.\n - While validating [BindGroupDescriptor] against [BindGroupLayout (unlabeled)]\n - While calling [Device].CreateBindGroup([BindGroupDescriptor]).\n",
        "warning: [Invalid BindGroup (unlabeled)] is invalid due to a previous error.\n - While encoding [ComputePassEncoder (unlabeled)].SetBindGroup(0, [Invalid BindGroup (unlabeled)], 0, ...).\n - While finishing [CommandEncoder (unlabeled)].\n",
        "warning: [Invalid CommandBuffer] is invalid due to a previous error.\n - While calling [Queue].Submit([[Invalid CommandBuffer]])\n",
        "warning: [Invalid BindGroup (unlabeled)] is invalid due to a previous error.\n - While encoding [ComputePassEncoder (unlabeled)].SetBindGroup(0, [Invalid BindGroup (unlabeled)], 0, ...).\n - While finishing [CommandEncoder (unlabeled)].\n",
        "warning: [Invalid CommandBuffer] is invalid due to a previous error.\n - While calling [Queue].Submit([[Invalid CommandBuffer]])\n",
        "warning: [Invalid BindGroup (unlabeled)] is invalid due to a previous error.\n - While encoding [ComputePassEncoder (unlabeled)].SetBindGroup(0, [Invalid BindGroup (unlabeled)], 0, ...).\n - While finishing [CommandEncoder (unlabeled)].\n",
        "warning: [Invalid CommandBuffer] is invalid due to a previous error.\n - While calling [Queue].Submit([[Invalid CommandBuffer]])\n",
        "warning: [Invalid BindGroup (unlabeled)] is invalid due to a previous error.\n - While encoding [ComputePassEncoder (unlabeled)].SetBindGroup(0, [Invalid BindGroup (unlabeled)], 0, ...).\n - While finishing [CommandEncoder (unlabeled)].\n",
        "warning: [Invalid CommandBuffer] is invalid due to a previous error.\n - While calling [Queue].Submit([[Invalid CommandBuffer]])\n",
        "warning: [Invalid BindGroup (unlabeled)] is invalid due to a previous error.\n - While encoding [ComputePassEncoder (unlabeled)].SetBindGroup(0, [Invalid BindGroup (unlabeled)], 0, ...).\n - While finishing [CommandEncoder (unlabeled)].\n",
        "warning: [Invalid CommandBuffer] is invalid due to a previous error.\n - While calling [Queue].Submit([[Invalid CommandBuffer]])\n"
      ],
      "env": {
        "browser": "chromium",
        "browser_version": "151.0.7922.34",
        "headless": true,
        "jspi": true,
        "litertjs_core_version": "2.5.3",
        "machine_label": "ci-ubuntu-x64",
        "os": "Linux",
        "os_version": "6.17.0-1022-azure",
        "webgpu_adapter": {
          "architecture": "swiftshader",
          "description": "",
          "device": "",
          "vendor": "google"
        }
      },
      "error": "run timed out after 60000ms",
      "failure_class": "timeout",
      "full_delegation": true,
      "latency_p50_ms": null,
      "loads": true,
      "max_abs_diff": null,
      "max_rel_diff": null,
      "output_match": null,
      "provenance": "measured",
      "runs": false
    }
  ],
  "schema_version": "1.0",
  "source": "https://huggingface.co/litert-community/SAM2.1-Hiera-Tiny-Mask-Decoder/resolve/main/sam2_tiny_mask_decoder_v2_fp16.tflite"
}
