{
  "config": {
    "input_seed": 42,
    "timed_runs": 10,
    "tolerance_abs": 0.00001,
    "tolerance_rel": 0.001,
    "warmup_runs": 3
  },
  "input_spec": "1x256x1024:float32",
  "license": "apache-2.0",
  "model_id": "qwen3-reranker-0.6b",
  "notes": "",
  "results": [
    {
      "backend": "wasm_xnnpack",
      "date": "2026-09-21",
      "delegation_evidence": [
        "error: WARNING: [npu_registry.cc:34] NPU accelerator could not be loaded and registered: kLiteRtStatusErrorInvalidArgument.",
        "error: WARNING: [npu_registry.cc:34] NPU accelerator could not be loaded and registered: kLiteRtStatusErrorInvalidArgument."
      ],
      "env": {
        "browser": "chromium",
        "browser_version": "151.0.7922.34",
        "headless": true,
        "jspi": true,
        "litertjs_core_version": "2.5.3",
        "machine_label": "ci-ubuntu-x64",
        "os": "Linux",
        "os_version": "6.17.0-1022-azure",
        "webgpu_adapter": {
          "architecture": "swiftshader",
          "description": "",
          "device": "",
          "vendor": "google"
        }
      },
      "error": "browser page crashed",
      "failure_class": "page_crash",
      "full_delegation": null,
      "latency_p50_ms": null,
      "loads": false,
      "max_abs_diff": null,
      "max_rel_diff": null,
      "output_match": null,
      "provenance": "measured",
      "runs": false
    },
    {
      "backend": "webgpu_mldrift",
      "date": "2026-09-21",
      "delegation_evidence": [
        "error: WARNING: [npu_registry.cc:34] NPU accelerator could not be loaded and registered: kLiteRtStatusErrorInvalidArgument.",
        "error: WARNING: [npu_registry.cc:34] NPU accelerator could not be loaded and registered: kLiteRtStatusErrorInvalidArgument.",
        "error: Aborted()"
      ],
      "env": {
        "browser": "chromium",
        "browser_version": "151.0.7922.34",
        "headless": true,
        "jspi": true,
        "litertjs_core_version": "2.5.3",
        "machine_label": "ci-ubuntu-x64",
        "os": "Linux",
        "os_version": "6.17.0-1022-azure",
        "webgpu_adapter": {
          "architecture": "swiftshader",
          "description": "",
          "device": "",
          "vendor": "google"
        }
      },
      "error": "RuntimeError: Aborted(). Build with -sASSERTIONS for more info.",
      "failure_class": "compile_error",
      "full_delegation": null,
      "latency_p50_ms": null,
      "loads": false,
      "max_abs_diff": null,
      "max_rel_diff": null,
      "output_match": null,
      "provenance": "measured",
      "runs": false
    }
  ],
  "schema_version": "1.0",
  "source": "https://huggingface.co/litert-community/Qwen3-Reranker-0.6B-LiteRT/resolve/main/qwen3rerank_gpu_fp16.tflite"
}
