{
  "config": {
    "input_seed": 42,
    "timed_runs": 10,
    "tolerance_abs": 0.00001,
    "tolerance_rel": 0.001,
    "warmup_runs": 3
  },
  "input_spec": "1x768x3072:float32;1x3072:float32",
  "license": "apache-2.0",
  "model_id": "flux.2-klein-4b__kc_final",
  "notes": "",
  "results": [
    {
      "backend": "wasm_xnnpack",
      "date": "2026-10-05",
      "delegation_evidence": [
        "error: WARNING: [npu_registry.cc:34] NPU accelerator could not be loaded and registered: kLiteRtStatusErrorInvalidArgument.",
        "error: WARNING: [npu_registry.cc:34] NPU accelerator could not be loaded and registered: kLiteRtStatusErrorInvalidArgument."
      ],
      "env": {
        "browser": "chromium",
        "browser_version": "151.0.7922.34",
        "headless": true,
        "jspi": true,
        "litertjs_core_version": "2.5.3",
        "machine_label": "ci-ubuntu-x64",
        "os": "Linux",
        "os_version": "6.17.0-1022-azure",
        "webgpu_adapter": {
          "architecture": "swiftshader",
          "description": "",
          "device": "",
          "vendor": "google"
        }
      },
      "error": null,
      "failure_class": null,
      "full_delegation": null,
      "latency_p50_ms": 8.982,
      "loads": true,
      "max_abs_diff": null,
      "max_rel_diff": null,
      "output_match": null,
      "provenance": "measured",
      "runs": true
    },
    {
      "backend": "webgpu_mldrift",
      "date": "2026-10-05",
      "delegation_evidence": [
        "error: WARNING: [npu_registry.cc:34] NPU accelerator could not be loaded and registered: kLiteRtStatusErrorInvalidArgument.",
        "error: WARNING: [npu_registry.cc:34] NPU accelerator could not be loaded and registered: kLiteRtStatusErrorInvalidArgument."
      ],
      "env": {
        "browser": "chromium",
        "browser_version": "151.0.7922.34",
        "headless": true,
        "jspi": true,
        "litertjs_core_version": "2.5.3",
        "machine_label": "ci-ubuntu-x64",
        "os": "Linux",
        "os_version": "6.17.0-1022-azure",
        "webgpu_adapter": {
          "architecture": "swiftshader",
          "description": "",
          "device": "",
          "vendor": "google"
        }
      },
      "error": null,
      "failure_class": null,
      "full_delegation": true,
      "latency_p50_ms": 892.28,
      "loads": true,
      "max_abs_diff": 0.2281300276517868,
      "max_rel_diff": 223.3387056934167,
      "output_match": false,
      "provenance": "measured",
      "runs": true
    }
  ],
  "schema_version": "1.0",
  "source": "https://huggingface.co/litert-community/FLUX.2-klein-4B-LiteRT/resolve/main/kc_final.tflite"
}
