{
  "config": {
    "input_seed": 42,
    "timed_runs": 10,
    "tolerance_abs": 0.00001,
    "tolerance_rel": 0.001,
    "warmup_runs": 3
  },
  "input_spec": "1x3x320x320:float32",
  "license": "apache-2.0",
  "model_id": "u-2-net",
  "notes": "",
  "results": [
    {
      "backend": "wasm_xnnpack",
      "date": "2026-08-22",
      "delegation_evidence": [
        "error: WARNING: [npu_registry.cc:34] NPU accelerator could not be loaded and registered: kLiteRtStatusErrorInvalidArgument.",
        "error: WARNING: [npu_registry.cc:34] NPU accelerator could not be loaded and registered: kLiteRtStatusErrorInvalidArgument."
      ],
      "env": {
        "browser": "chromium",
        "browser_version": "151.0.7922.34",
        "headless": true,
        "jspi": true,
        "litertjs_core_version": "2.5.3",
        "machine_label": "mac-studio-m4-max",
        "os": "macOS",
        "os_version": "27.0.0",
        "webgpu_adapter": {
          "architecture": "metal-3",
          "description": "",
          "device": "",
          "vendor": "apple"
        }
      },
      "error": "run timed out after 60000ms",
      "failure_class": "timeout",
      "full_delegation": null,
      "latency_p50_ms": null,
      "loads": true,
      "max_abs_diff": null,
      "max_rel_diff": null,
      "output_match": null,
      "provenance": "measured",
      "runs": false
    },
    {
      "backend": "webgpu_mldrift",
      "date": "2026-08-22",
      "delegation_evidence": [
        "error: WARNING: [npu_registry.cc:34] NPU accelerator could not be loaded and registered: kLiteRtStatusErrorInvalidArgument.",
        "error: WARNING: [npu_registry.cc:34] NPU accelerator could not be loaded and registered: kLiteRtStatusErrorInvalidArgument."
      ],
      "env": {
        "browser": "chromium",
        "browser_version": "151.0.7922.34",
        "headless": true,
        "jspi": true,
        "litertjs_core_version": "2.5.3",
        "machine_label": "mac-studio-m4-max",
        "os": "macOS",
        "os_version": "27.0.0",
        "webgpu_adapter": {
          "architecture": "metal-3",
          "description": "",
          "device": "",
          "vendor": "apple"
        }
      },
      "error": null,
      "failure_class": null,
      "full_delegation": true,
      "latency_p50_ms": 35.323,
      "loads": true,
      "max_abs_diff": null,
      "max_rel_diff": null,
      "output_match": null,
      "provenance": "measured",
      "runs": true
    }
  ],
  "schema_version": "1.0",
  "source": "https://huggingface.co/litert-community/U-2-Net/resolve/main/u2net_fp16.tflite"
}
